,title,content,date,variant,images,verified,author,rating,product,url,review,review_id,nouns
0,Good mid- ranger phone,"Reviewing after using it for last 3 days, bought from an offline store: 1. Display is superb with 120hz and 60hz refresh rate option. 2. Sound quality is good and loud from dual front speakers. 3. Camera is having upto 30x zoom and other pro features. It could have been bit better for wide angle but night mode is sufficiently good. 4. Comes with a 15W charger, but supports upto 25W fast & wireless charging. 5. Phone back is polycarbonate which looks decent enough to hold. One plus 9 may look more premium with all glass back but will be more delicate as well. 6. Snapdragon 865 processor is fast if not the fastest like SD888 on one plus 9. 7. 5G support - will support around 9 5G bands in future as compared to just 2 5G bands of one plus 9. S20FE 5G looks more future ready on paper. More 5G bands getting enabled with software updates on one plus 9 is debatable and need to wait n watch. 8. Phone is IP68 dust and water proof, which isn't offered by one plus 9. 9. Expandable memory upto 1TB support not offered by one plus 9. 10. Battery same 4500 mah on this phone as well as one plus  9 but latter comes with a 65W wrap charger. Verdict - GO FOR IT. One of the best mid- range segment phones from Samsung competing against one plus 9. Both having their own winning areas, boils down to one's own preferences.",12 Apr 2021,Colour: Cloud Navy Size name: 8GB Style name: With offer,"https://images-na.ssl-images-amazon.com/images/I/61b-fK7AJSL._SY88.jpg
https://images-na.ssl-images-amazon.com/images/I/71-NO9cNGkL._SY88.jpg
https://images-na.ssl-images-amazon.com/images/I/71yqSmif6cL._SY88.jpg",No,Aror Tech,5.0,"Samsung Galaxy S20 FE 5G (Cloud Navy, 8GB RAM, 128GB Storage) with No Cost EMI & Additional Exchange Offers",https://www.amazon.in/Samsung-Galaxy-Cloud-128GB-Storage/product-reviews/B08VB57558/ref=cm_cr_dp_d_show_all_btm?ie=UTF8&reviewerType=all_reviews&pageNumber=0,reviewing after using it for last 3 days bought from an offline store 1 display is superb with 120hz and 60hz refresh rate option 2 sound quality is good and loud from dual front speakers 3 camera is having upto 30x zoom and other pro features it could have been bit better for wide angle but night mode is sufficiently good 4 comes with a 15w charger but supports upto 25w fast wireless charging 5 phone back is polycarbonate which looks decent enough to hold one plus 9 may look more premium with all glass back but will be more delicate as well 6 snapdragon 865 processor is fast if not the fastest like sd888 on one plus 9 7 5g support will support around 9 5g bands in future as compared to just 2 5g bands of one plus 9 s20fe 5g looks more future ready on paper more 5g bands getting enabled with software updates on one plus 9 is debatable and need to wait n watch 8 phone is ip68 dust and water proof which isnt offered by one plus 9 9 expandable memory upto 1tb support not offered by one plus 9 10 battery same 4500 mah on this phone as well as one plus 9 but latter comes with a 65w wrap charger verdict go for it one of the best mid range segment phones from samsung competing against one plus 9 both having their own winning areas boils down to ones own preferences,0,"['days', 'offline', 'store', 'display', 'rate', 'option', 'sound', 'quality', 'front', 'speakers', 'camera', 'zoom', 'features', 'angle', 'night', 'mode', 'charger', 'wireless', 'phone', 'polycarbonate', 'premium', 'glass', 'snapdragon', 'processor', 'sd888', 'support', 'bands', 'bands', 'ready', 'paper', 'bands', 'software', 'updates', 'watch', 'phone', 'dust', 'water', 'proof', 'isnt', 'memory', 'support', 'battery', 'mah', 'phone', 'wrap', 'charger', 'verdict', 'mid', 'range', 'segment', 'phones', 'samsung', 'areas', 'ones', 'preferences']"
1,Not up to the mark,"no sim card pin, there was no headphone. packing was not up to the mark ,with respect to the price of the product The product heats up very fast",14 Apr 2021,,,Yes,Ashraf ali,3.0,"Samsung Galaxy S20 FE 5G (Cloud Navy, 8GB RAM, 128GB Storage) with No Cost EMI & Additional Exchange Offers",https://www.amazon.in/Samsung-Galaxy-Cloud-128GB-Storage/product-reviews/B08VB57558/ref=cm_cr_dp_d_show_all_btm?ie=UTF8&reviewerType=all_reviews&pageNumber=0,no sim card pin there was no headphone packing was not up to the mark with respect to the price of the product the product heats up very fast,1,"['card', 'pin', 'headphone', 'packing', 'mark', 'respect', 'price', 'product', 'product']"
2,Before you buy - please be aware - YOU GONNA GET A CRAP AT 45K,Bought this a day back At this price range I felt this phone is a crap. Here are the reasons why 1) Terrible heating issue near to the camera with moderate usage - Might be from the processor 2) Battery optimization  sucks - with moderate usage it dint lasted for 7 hours 3)Only 15W Charger will be in the box 3) At this price range competitors provide better finger print reader 4) cheaper corilla glass 3 is used 5) Snapdragon  860 and 865 has some heating issues  and other issues 6)Back design makes this phone less premium Overall at 40k price - This phone in not woth for the money 😑 ...if you're looking for mid flagship camera..then you can go for this phone. Considering  the heating issue this phone rate will drop further.. When it drops to 30k you can buy this phone,22 May 2021,Colour: Cloud Navy Size name: 8GB Style name: With offer,,Yes,Subashg07,2.0,"Samsung Galaxy S20 FE 5G (Cloud Navy, 8GB RAM, 128GB Storage) with No Cost EMI & Additional Exchange Offers",https://www.amazon.in/Samsung-Galaxy-Cloud-128GB-Storage/product-reviews/B08VB57558/ref=cm_cr_dp_d_show_all_btm?ie=UTF8&reviewerType=all_reviews&pageNumber=0,bought this a day back at this price range i felt this phone is a crap here are the reasons why 1 terrible heating issue near to the camera with moderate usage might be from the processor 2 battery optimization sucks with moderate usage it dint lasted for 7 hours 3only 15w charger will be in the box 3 at this price range competitors provide better finger print reader 4 cheaper corilla glass 3 is used 5 snapdragon 860 and 865 has some heating issues and other issues 6back design makes this phone less premium overall at 40k price this phone in not woth for the money if youre looking for mid flagship camera then you can go for this phone considering the heating issue this phone rate will drop further when it drops to 30k you can buy this phone,2,"['day', 'price', 'range', 'phone', 'crap', 'reasons', 'issue', 'camera', 'usage', 'processor', 'battery', 'optimization', 'sucks', 'usage', 'hours', 'charger', 'box', 'price', 'range', 'competitors', 'finger', 'print', 'reader', 'corilla', 'glass', 'heating', 'issues', 'issues', 'design', 'phone', 'overall', 'price', 'phone', 'money', 'youre', 'flagship', 'camera', 'phone', 'heating', 'issue', 'phone', 'rate', 'phone']"
3,Best phone below 50k hands down..,"I was using OnePlus 5t for last 3 years. Thought of changing the phone and after made lot of research choose samsung s20 fe over OnePlus 9 and till date I don't have any regret for that.. it's simply an amazing phone. Pros: 1. Camera: Please don't go with the camera mega pixel and sensors specifications.. it's all just a number, in the end it only matters how good the picture is. Samsung is way way better than OnePlus in this aspect. Added few examples above. 2. Display: 120 hz super amoled display by samsung, what else you want. 3. Sound: crisp and clear with dual speakers.. 4. Battery: easily it gives me 10 hrs on screen back up, not a gamer though. Cons: 1. 15w charger is just less imo, 25w would have been ideal. 2. Brightness could have been more, not a major problem though. 3. Very new to one ui, but as per the initial impression oxygen os was better. 4. Fingerprint reader could have been better. Edit: OneUI is awesome.. may be oxygen os is simple and easy to use..but one UI has lot of useful features based on AI. Too good in my opinion.",09 May 2021,Colour: Cloud Navy Size name: 8GB Style name: With offer,"https://images-na.ssl-images-amazon.com/images/I/91NRZcd3x8L._SY88.jpg
https://images-na.ssl-images-amazon.com/images/I/B1UO+L1zmbS._SY88.jpg
https://images-na.ssl-images-amazon.com/images/I/B1d96r2S4tS._SY88.jpg
https://images-na.ssl-images-amazon.com/images/I/C1uqLf24cCS._SY88.jpg",Yes,Swarnendu Chaudhuri,5.0,"Samsung Galaxy S20 FE 5G (Cloud Navy, 8GB RAM, 128GB Storage) with No Cost EMI & Additional Exchange Offers",https://www.amazon.in/Samsung-Galaxy-Cloud-128GB-Storage/product-reviews/B08VB57558/ref=cm_cr_dp_d_show_all_btm?ie=UTF8&reviewerType=all_reviews&pageNumber=0,i was using oneplus 5t for last 3 years thought of changing the phone and after made lot of research choose samsung s20 fe over oneplus 9 and till date i dont have any regret for that its simply an amazing phone pros 1 camera please dont go with the camera mega pixel and sensors specifications its all just a number in the end it only matters how good the picture is samsung is way way better than oneplus in this aspect added few examples above 2 display 120 hz super amoled display by samsung what else you want 3 sound crisp and clear with dual speakers 4 battery easily it gives me 10 hrs on screen back up not a gamer though cons 1 15w charger is just less imo 25w would have been ideal 2 brightness could have been more not a major problem though 3 very new to one ui but as per the initial impression oxygen os was better 4 fingerprint reader could have been better edit oneui is awesome may be oxygen os is simple and easy to use but one ui has lot of useful features based on ai too good in my opinion,3,"['years', 'phone', 'lot', 'research', 'choose', 'samsung', 's20', 'date', 'regret', 'phone', 'pros', 'camera', 'please', 'dont', 'camera', 'pixel', 'sensors', 'specifications', 'number', 'end', 'picture', 'way', 'way', 'aspect', 'examples', 'display', 'super', 'display', 'samsung', 'sound', 'crisp', 'speakers', 'battery', 'hrs', 'screen', 'gamer', 'cons', 'charger', 'brightness', 'problem', 'impression', 'oxygen', 'fingerprint', 'reader', 'edit', 'oneui', 'lot', 'features', 'opinion']"
4,VFM Flagship phone from Samsung,"Writing this review after 3 months of usage. Will divide this review into pros and cons. First, the Pros: 1.Software and One UI-Many people complain that One UI is bloated and it's bad compared to stock android or other brands.This is not the case, It comes with a lot of useful features like improved security (knox) and app management. There are no ADS apart from a couple of apps like weather which can be disabled, Also, ads will be disabled in future updates. Samsung also is excellent in providing software and security updates,with 3years software support.So you won't feel let down on the software experience. 2.Performance-Snapdragon 865 is Snappy and efficient, no lags whatsoever Can handle heavy applications and games thanks to 8 GB RAM, improved thermal and battery performance compared to exynos variant.Lot of people complaining about Samsung phones heating up, There is a difference between getting warm and heating up. This device never heats up and getting warm is normal on any smartphone. this is not the case only with Samsung but I have used phones from other brands and they too get warm after using it for an hour or so continuously. . I'm not a samsung fan but criticizing a product without proper research can prevent prospective users from buying good products. 3.Network Connectivity: Have used the phone while traveling and did not experience network drops, Radio reception is very good and call experience was great. 4.Camera: This device comes with good set of cameras (triple camera)and takes great pictures, Samsung's camera optimization is good compared to competition at this price point. 5.Sound and Media experience: Excellent sound output thanks to dual stereo speakers, watching media even without a headset is a great experience. Comes with dolby atmos support. Amazing experience with galaxy buds 2 which you can buy separately. 6.Display-Samoled Display is amazing. Supports upto 120hz refresh rate which makes things buttery smooth.The color reproduction is excellent and samsung makes displays for other renowned brands.Supports HDR videos, tested on YouTube but doesn't work on Netflix because Netflix has to certify the device and not a problem with the device. Overall, media consumption has been a great experience. 7.Great build quality: The phone can survive a few drops. Front is corning gorilla glass 3 back is premium plastic with metal frame. The phone is also IP68 certified for dust and water resistance. 8.Battery: This is not exactly a pro but included in the pro section because there are a lot of people criticizing battery life. The battery performance is neither a pro nor a con, similar to other devices available at this price point.The device has a 4500 MAH battery and easily lasts a day and half with heavy to moderate use and standby will last even longer, I charge the phone once a day, which is similar to all the smartphones in this price range. You can easily expect a screen on time of 7 to 8 hours which not really something that deserves criticizing. 9.5G ready with 9 5g bands. Cons: 1. Only 15 watt charger included in the box by samsung which takes atleast 1.5 hours to charge the phone. Could have been better with atleast a 25 watt charger in the box. When competitors are providing 30+ watt chargers in this price range. 2.Fingerprint scanner: comes with an in display fingerprint sensor which works well most of the time but it is clumsy at times. 3.Average front camera. Verdict: value for money smartphone at this pricepoint. A good smartphone investment for the next couple or 3 years.I liked this device and again it is personal preference. I have made an effort to highlight the device's pros and cons which could help a prospective buyer.",28 Sep 2021,Colour: Cloud Navy Size name: 8GB Style name: With offer,,Yes,NS,5.0,"Samsung Galaxy S20 FE 5G (Cloud Navy, 8GB RAM, 128GB Storage) with No Cost EMI & Additional Exchange Offers",https://www.amazon.in/Samsung-Galaxy-Cloud-128GB-Storage/product-reviews/B08VB57558/ref=cm_cr_dp_d_show_all_btm?ie=UTF8&reviewerType=all_reviews&pageNumber=0,writing this review after 3 months of usage will divide this review into pros and cons first the pros 1 software and one ui many people complain that one ui is bloated and its bad compared to stock android or other brands this is not the case it comes with a lot of useful features like improved security knox and app management there are no ads apart from a couple of apps like weather which can be disabled also ads will be disabled in future updates samsung also is excellent in providing software and security updateswith 3years software support so you wont feel let down on the software experience 2 performance snapdragon 865 is snappy and efficient no lags whatsoever can handle heavy applications and games thanks to 8 gb ram improved thermal and battery performance compared to exynos variant lot of people complaining about samsung phones heating up there is a difference between getting warm and heating up this device never heats up and getting warm is normal on any smartphone this is not the case only with samsung but i have used phones from other brands and they too get warm after using it for an hour or so continuously im not a samsung fan but criticizing a product without proper research can prevent prospective users from buying good products 3 network connectivity have used the phone while traveling and did not experience network drops radio reception is very good and call experience was great 4 camera this device comes with good set of cameras triple cameraand takes great pictures samsungs camera optimization is good compared to competition at this price point 5 sound and media experience excellent sound output thanks to dual stereo speakers watching media even without a headset is a great experience comes with dolby atmos support amazing experience with galaxy buds 2 which you can buy separately 6 display samoled display is amazing supports upto 120hz refresh rate which makes things buttery smooth the color reproduction is excellent and samsung makes displays for other renowned brands supports hdr videos tested on youtube but doesnt work on netflix because netflix has to certify the device and not a problem with the device overall media consumption has been a great experience 7 great build quality the phone can survive a few drops front is corning gorilla glass 3 back is premium plastic with metal frame the phone is also ip68 certified for dust and water resistance 8 battery this is not exactly a pro but included in the pro section because there are a lot of people criticizing battery life the battery performance is neither a pro nor a con similar to other devices available at this price point the device has a 4500 mah battery and easily lasts a day and half with heavy to moderate use and standby will last even longer i charge the phone once a day which is similar to all the smartphones in this price range you can easily expect a screen on time of 7 to 8 hours which not really something that deserves criticizing 9 5g ready with 9 5g bands cons 1 only 15 watt charger included in the box by samsung which takes atleast 1 5 hours to charge the phone could have been better with atleast a 25 watt charger in the box when competitors are providing 30 watt chargers in this price range 2 fingerprint scanner comes with an in display fingerprint sensor which works well most of the time but it is clumsy at times 3 average front camera verdict value for money smartphone at this pricepoint a good smartphone investment for the next couple or 3 years i liked this device and again it is personal preference i have made an effort to highlight the devices pros and cons which could help a prospective buyer,4,"['review', 'months', 'usage', 'review', 'pros', 'cons', 'pros', 'software', 'people', 'stock', 'android', 'brands', 'case', 'lot', 'features', 'security', 'knox', 'management', 'ads', 'couple', 'apps', 'weather', 'ads', 'updates', 'samsung', 'software', 'security', 'software', 'support', 'software', 'experience', 'performance', 'snapdragon', 'whatsoever', 'applications', 'games', 'thanks', 'ram', 'battery', 'performance', 'lot', 'people', 'samsung', 'phones', 'difference', 'device', 'smartphone', 'case', 'samsung', 'phones', 'brands', 'hour', 'samsung', 'fan', 'product', 'research', 'users', 'products', 'network', 'connectivity', 'phone', 'network', 'drops', 'radio', 'reception', 'experience', 'camera', 'device', 'set', 'cameras', 'cameraand', 'pictures', 'samsungs', 'camera', 'optimization', 'competition', 'price', 'point', 'sound', 'media', 'experience', 'sound', 'output', 'thanks', 'stereo', 'speakers', 'media', 'headset', 'experience', 'support', 'experience', 'galaxy', 'buds', 'display', 'display', 'supports', 'refresh', 'rate', 'things', 'color', 'reproduction', 'displays', 'brands', 'supports', 'youtube', 'work', 'netflix', 'netflix', 'device', 'problem', 'device', 'media', 'consumption', 'experience', 'quality', 'phone', 'drops', 'glass', 'back', 'plastic', 'metal', 'frame', 'phone', 'dust', 'water', 'resistance', 'battery', 'section', 'lot', 'people', 'battery', 'life', 'battery', 'performance', 'con', 'devices', 'price', 'point', 'device', 'mah', 'battery', 'day', 'half', 'use', 'standby', 'phone', 'day', 'smartphones', 'price', 'range', 'screen', 'time', 'hours', 'something', 'bands', 'cons', 'charger', 'box', 'samsung', 'hours', 'phone', 'watt', 'charger', 'box', 'competitors', 'chargers', 'price', 'range', 'fingerprint', 'scanner', 'display', 'fingerprint', 'sensor', 'time', 'times', 'camera', 'verdict', 'value', 'money', 'smartphone', 'pricepoint', 'smartphone', 'investment', 'couple', 'years', 'device', 'preference', 'effort', 'devices', 'pros', 'cons', 'buyer']"
5,Worst product,Pros: Good display Stereo speaker IP68 Wireless charging Cons: Battery drains very fast Fingerprint is laggy Below average camera quality Very old gorilla glass3 on the front. Plastic back panel. No specifications about camera lens protective glass. Cannot view HDR content from Netflix No DAC for audio over Type-C headphones. Only digital audio over Type-C USB port. Cannot use wired headphones with any Type-C adapters. Very high price for such a product.,18 Jun 2021,Colour: Cloud Navy Size name: 8GB Style name: With offer,,Yes,well wisher,1.0,"Samsung Galaxy S20 FE 5G (Cloud Navy, 8GB RAM, 128GB Storage) with No Cost EMI & Additional Exchange Offers",https://www.amazon.in/Samsung-Galaxy-Cloud-128GB-Storage/product-reviews/B08VB57558/ref=cm_cr_dp_d_show_all_btm?ie=UTF8&reviewerType=all_reviews&pageNumber=0,pros good display stereo speaker ip68 wireless charging cons battery drains very fast fingerprint is laggy below average camera quality very old gorilla glass3 on the front plastic back panel no specifications about camera lens protective glass cannot view hdr content from netflix no dac for audio over type c headphones only digital audio over type c usb port cannot use wired headphones with any type c adapters very high price for such a product,5,"['pros', 'display', 'stereo', 'speaker', 'ip68', 'wireless', 'cons', 'battery', 'fingerprint', 'camera', 'quality', 'gorilla', 'glass3', 'front', 'plastic', 'panel', 'specifications', 'camera', 'lens', 'glass', 'content', 'dac', 'audio', 'headphones', 'audio', 'port', 'headphones', 'type', 'adapters', 'price', 'product']"
6,Best value for money.,"For the price of 48k, I see this device as the perfect balance between performance, value and future proof. I bought this instead of OnePlus 9 and 9R and do not regret this decision at all.",20 Apr 2021,Colour: Cloud Green Size name: 8GB RAM + 128GB Storage Style name: With offer,"https://images-na.ssl-images-amazon.com/images/I/61g3yi8uUeL._SY88.jpg
https://images-na.ssl-images-amazon.com/images/I/A112tuYYzFL._SY88.jpg",Yes,sandhya gupta,5.0,"Samsung Galaxy S20 FE 5G (Cloud Navy, 8GB RAM, 128GB Storage) with No Cost EMI & Additional Exchange Offers",https://www.amazon.in/Samsung-Galaxy-Cloud-128GB-Storage/product-reviews/B08VB57558/ref=cm_cr_dp_d_show_all_btm?ie=UTF8&reviewerType=all_reviews&pageNumber=0,for the price of 48k i see this device as the perfect balance between performance value and future proof i bought this instead of oneplus 9 and 9r and do not regret this decision at all,6,"['price', 'device', 'balance', 'performance', 'value', 'proof', 'decision']"
