,title,content,date,variant,images,verified,author,rating,product,url,review,review_id,nouns
30,Great mobile,"Good camera, good battery, super smooth display,dolby atmos music, bixby. And main thing for me is Sumsung dex...wahh maza aa geya.. Snapdragon Processor is good, 120 hz samsung display..5g phone..",15 Jul 2021,Colour: Navy Size name: 8GB+128Gb Style name: Without offer,"https://images-na.ssl-images-amazon.com/images/I/81Xgfi2fKnL._SY88.jpg
https://images-na.ssl-images-amazon.com/images/I/91Jb7mQBshL._SY88.jpg
https://images-na.ssl-images-amazon.com/images/I/91K-2GEAgFL._SY88.jpg",Yes,Nilmadhav,4.0,"Samsung Galaxy S20 FE 5G (Cloud Navy, 8GB RAM, 128GB Storage) with No Cost EMI & Additional Exchange Offers",https://www.amazon.in/Samsung-Galaxy-Cloud-128GB-Storage/product-reviews/B08VB57558/ref=cm_cr_dp_d_show_all_btm?ie=UTF8&reviewerType=all_reviews&pageNumber=3,good camera good battery super smooth displaydolby atmos music bixby and main thing for me is sumsung dex wahh maza aa geya snapdragon processor is good 120 hz samsung display 5g phone,30,"['camera', 'battery', 'atmos', 'music', 'bixby', 'thing', 'dex', 'wahh', 'maza', 'geya', 'snapdragon', 'processor', 'samsung', 'phone']"
31,Bad decision  to switch from oneplus,"Like: camera Screen touch is decent Dislike Selfish camera is not upto the mark, I have one plus 5t and it's selfish camera is more natural then s20 fe Amount of time it takes to charge the device almost 2 hrs. UI Calling option does not have direct changing  option for Sim cards I am not able to return the product Stuck with it Device is hanging",24 May 2021,Colour: Cloud Navy Size name: 8GB Style name: With offer,,Yes,Hirak Parmar,1.0,"Samsung Galaxy S20 FE 5G (Cloud Navy, 8GB RAM, 128GB Storage) with No Cost EMI & Additional Exchange Offers",https://www.amazon.in/Samsung-Galaxy-Cloud-128GB-Storage/product-reviews/B08VB57558/ref=cm_cr_dp_d_show_all_btm?ie=UTF8&reviewerType=all_reviews&pageNumber=3,like camera screen touch is decent dislike selfish camera is not upto the mark i have one plus 5t and its selfish camera is more natural then s20 fe amount of time it takes to charge the device almost 2 hrs ui calling option does not have direct changing option for sim cards i am not able to return the product stuck with it device is hanging,31,"['camera', 'screen', 'touch', 'camera', 'mark', 'camera', 'amount', 'time', 'device', 'option', 'option', 'sim', 'cards', 'product', 'stuck', 'device']"
32,You need to know this before you make your buying decisions,"This phone comes with a IP68 rating. I have been using this phone for last 3 months. Presently it is having some charging problem. It is showing that moisture or foreign material is there in charging port. Same need to be dried or removed prior to using that port for  charging. In the mean time wireless charger can be used to charge the phone. After seeing this,  I took my mobile to Samsung care. There they said that the charging port is completely damaged because of moisture ingress. Same need to be replaced. And this will cost around Rs 1850. !!!! No free service within warranty period😔 !!!! So I request all the potential buyers to answer this. Q-1) If having a IP 68 rating mobile cannot resist moisture attack, then what's the point. Q-2) Within warranty period and for a IP68 rating phone, whether a customer need to pay for any damage because of moisture ingress.",12 Aug 2021,Colour: Cloud Green Size name: 8GB RAM + 128GB Storage Style name: With offer,,Yes,Amazon Customer,3.0,"Samsung Galaxy S20 FE 5G (Cloud Navy, 8GB RAM, 128GB Storage) with No Cost EMI & Additional Exchange Offers",https://www.amazon.in/Samsung-Galaxy-Cloud-128GB-Storage/product-reviews/B08VB57558/ref=cm_cr_dp_d_show_all_btm?ie=UTF8&reviewerType=all_reviews&pageNumber=3,this phone comes with a ip68 rating i have been using this phone for last 3 months presently it is having some charging problem it is showing that moisture or foreign material is there in charging port same need to be dried or removed prior to using that port for charging in the mean time wireless charger can be used to charge the phone after seeing this i took my mobile to samsung care there they said that the charging port is completely damaged because of moisture ingress same need to be replaced and this will cost around rs 1850 no free service within warranty period so i request all the potential buyers to answer this q 1 if having a ip 68 rating mobile cannot resist moisture attack then whats the point q 2 within warranty period and for a ip68 rating phone whether a customer need to pay for any damage because of moisture ingress,32,"['phone', 'ip68', 'rating', 'phone', 'months', 'problem', 'moisture', 'material', 'port', 'need', 'port', 'time', 'charger', 'phone', 'mobile', 'care', 'port', 'moisture', 'ingress', 'need', 'service', 'period', 'buyers', 'rating', 'mobile', 'moisture', 'attack', 'point', 'period', 'ip68', 'rating', 'phone', 'customer', 'need', 'damage', 'moisture', 'ingress']"
33,Good choice over other phones in same price segment,Good choice over other phones in same price segment. Fingerprint is average. After some settings changed its perfect and fast. And if u use always on display u can locate the fingerprint sensor and unlock screen fast. Better to use face its very good. Battery life is nice. And camera is superb. Far better than oneplus 9 series. Overall good product.,14 May 2021,Colour: Cloud Navy Size name: 8GB Style name: With offer,"https://images-na.ssl-images-amazon.com/images/I/A1ulNBf9JjL._SY88.jpg
https://images-na.ssl-images-amazon.com/images/I/B1H3UcRQtoS._SY88.jpg",Yes,Sukrit,5.0,"Samsung Galaxy S20 FE 5G (Cloud Navy, 8GB RAM, 128GB Storage) with No Cost EMI & Additional Exchange Offers",https://www.amazon.in/Samsung-Galaxy-Cloud-128GB-Storage/product-reviews/B08VB57558/ref=cm_cr_dp_d_show_all_btm?ie=UTF8&reviewerType=all_reviews&pageNumber=3,good choice over other phones in same price segment fingerprint is average after some settings changed its perfect and fast and if u use always on display u can locate the fingerprint sensor and unlock screen fast better to use face its very good battery life is nice and camera is superb far better than oneplus 9 series overall good product,33,"['choice', 'phones', 'price', 'segment', 'fingerprint', 'settings', 'perfect', 'fast', 'use', 'display', 'fingerprint', 'sensor', 'unlock', 'screen', 'face', 'battery', 'life', 'camera', 'series', 'product']"
34,MVP in below ₹50k price bracket,"I purchased this phone after extensive research (~5 months) of YouTube reviews as well as real ownership experience from family and friends of many phones in the 25k to 40k INR price bracket. I was able to get this one at 38k after exchange of my existing phone. Have to say that this is the best one in this price range and even under 50k. All flagship features that a person would want are available at this price. And I'm speaking from experience of having used iPhone XS and OnePlus 7T Pro of my own parents. Haven't faced any heating (or even warming) issue except during initial setup. For people who still aren't convinced, I will update my review after using for 2 weeks and then again after a month if needed. Edit (25-06-2021): After 2 weeks of extensive usage, I can still confirm that I have faced zero heating issues and very rare ""warming"" from this phone. One suggestion which I would make to existing and potential owners of this phone is to go to Settings->Connections->Mobile networks and change it to LTE/3G/2G from the existing 5G option. I'm still getting maximum 4G and 4G+ speeds without the phone having to search for non-existant 5G networks in India. For Screen-on-time, I'm consistently getting ~6.5 hours(Display at 120Hz), easily lasting a full day and having to recharge only the next day. P.S: If you are a hardcore gamer and are willing to shell out 40k+ on a phone then ROG phones would be better for you. In all other aspects, this phone takes the cake. P.P.S : If you don't have a pair of Bluetooth earphones already and don't plan on getting one either, just buy the official Samsung Type C to headphone jack adapter. Works brilliantly well! Just google Samsung EE-UC10JUWEGIN",12 Jun 2021,Colour: Cloud Navy Size name: 8GB Style name: With offer,,Yes,MansNotBot,5.0,"Samsung Galaxy S20 FE 5G (Cloud Navy, 8GB RAM, 128GB Storage) with No Cost EMI & Additional Exchange Offers",https://www.amazon.in/Samsung-Galaxy-Cloud-128GB-Storage/product-reviews/B08VB57558/ref=cm_cr_dp_d_show_all_btm?ie=UTF8&reviewerType=all_reviews&pageNumber=3,i purchased this phone after extensive research 5 months of youtube reviews as well as real ownership experience from family and friends of many phones in the 25k to 40k inr price bracket i was able to get this one at 38k after exchange of my existing phone have to say that this is the best one in this price range and even under 50k all flagship features that a person would want are available at this price and im speaking from experience of having used iphone xs and oneplus 7t pro of my own parents havent faced any heating or even warming issue except during initial setup for people who still arent convinced i will update my review after using for 2 weeks and then again after a month if needed edit 25 06 2021 after 2 weeks of extensive usage i can still confirm that i have faced zero heating issues and very rare warming from this phone one suggestion which i would make to existing and potential owners of this phone is to go to settings connections mobile networks and change it to lte3g2g from the existing 5g option im still getting maximum 4g and 4g speeds without the phone having to search for non existant 5g networks in india for screen on time im consistently getting 6 5 hoursdisplay at 120hz easily lasting a full day and having to recharge only the next day p s if you are a hardcore gamer and are willing to shell out 40k on a phone then rog phones would be better for you in all other aspects this phone takes the cake p p s if you dont have a pair of bluetooth earphones already and dont plan on getting one either just buy the official samsung type c to headphone jack adapter works brilliantly well just google samsung ee uc10juwegin,34,"['phone', 'research', 'months', 'reviews', 'ownership', 'experience', 'family', 'friends', 'phones', 'price', 'bracket', 'exchange', 'phone', 'one', 'price', 'range', 'flagship', 'person', 'price', 'speaking', 'experience', 'iphone', 'pro', 'parents', 'havent', 'heating', 'issue', 'setup', 'people', 'review', 'weeks', 'month', 'edit', 'weeks', 'usage', 'issues', 'phone', 'suggestion', 'owners', 'phone', 'connections', 'networks', 'option', 'speeds', 'phone', 'networks', 'india', 'screen', 'time', 'hoursdisplay', 'day', 'day', 'hardcore', 'gamer', 'phone', 'phones', 'aspects', 'phone', 'cake', 'pair', 'earphones', 'plan', 'samsung', 'type', 'jack', 'adapter', 'google', 'samsung', 'uc10juwegin']"
35,"Overall a very good phone, but with very slow charging!","I've used this phone for a month and a half now. Here's my review for the same - 1. Camera is really good 9/10 2. Audio quality is good, though the volume is a little on the lower side 6/10 3. Battery life is decent, I can mostly get through the day without having to charge it 7/10 4. Charging is too slow, like the older generation phones without any fast charging. Takes 2hrs for my phone to charge fully. Update - The 25w charger fills it up pretty fast. Takes around an hour. 4/10 5. Display is good and smooth 9/10 6. OneUI. This is my first samsung phone and I loved the software's look and feel, how the notifications and app drawer have amazing blur effects in the background. There are still a few bugs here and there though 8/10 7. Fingerprint reader is slow but accurate 5/10 8. Face recognition fails most of the time, to a point that I've stopped using it now 1/10 9. Call quality and audio is amazing on this phone. It is very loud and crispy clear 10/10 10. The phone gets heat up a lot, on the upper side of the body and screen, while charging as well as gaming. I'm actually scared to buy the 25w charger thinking that it might make the phone heat up even more 7/10 Update - I got the 25w charger and it didn't heat up at all.",28 May 2021,Colour: Cloud Navy Size name: 8GB Style name: With offer,,Yes,Divyanshu Mishra,4.0,"Samsung Galaxy S20 FE 5G (Cloud Navy, 8GB RAM, 128GB Storage) with No Cost EMI & Additional Exchange Offers",https://www.amazon.in/Samsung-Galaxy-Cloud-128GB-Storage/product-reviews/B08VB57558/ref=cm_cr_dp_d_show_all_btm?ie=UTF8&reviewerType=all_reviews&pageNumber=3,ive used this phone for a month and a half now heres my review for the same 1 camera is really good 910 2 audio quality is good though the volume is a little on the lower side 610 3 battery life is decent i can mostly get through the day without having to charge it 710 4 charging is too slow like the older generation phones without any fast charging takes 2hrs for my phone to charge fully update the 25w charger fills it up pretty fast takes around an hour 410 5 display is good and smooth 910 6 oneui this is my first samsung phone and i loved the softwares look and feel how the notifications and app drawer have amazing blur effects in the background there are still a few bugs here and there though 810 7 fingerprint reader is slow but accurate 510 8 face recognition fails most of the time to a point that ive stopped using it now 110 9 call quality and audio is amazing on this phone it is very loud and crispy clear 1010 10 the phone gets heat up a lot on the upper side of the body and screen while charging as well as gaming im actually scared to buy the 25w charger thinking that it might make the phone heat up even more 710 update i got the 25w charger and it didnt heat up at all,35,"['ive', 'phone', 'month', 'half', 'review', 'camera', 'quality', 'volume', 'side', 'battery', 'life', 'day', 'charging', 'generation', 'phones', 'charging', 'phone', 'charger', 'fills', 'hour', 'display', 'oneui', 'samsung', 'phone', 'softwares', 'notifications', 'app', 'drawer', 'blur', 'effects', 'background', 'bugs', 'fingerprint', 'reader', 'face', 'recognition', 'time', 'point', 'call', 'quality', 'audio', 'phone', 'phone', 'lot', 'side', 'body', 'screen', 'charger', 'thinking', 'phone', 'heat', 'charger', 'heat']"
36,No Gimmicks + DEX + Excellent Camera,"In this era of 2MP macro-mono-depth stupidity in midrangers and budget-flagships, this device stands out with its pure functional and flagship-like camera setup. DEX is another amazing functionality, i wonder why people are not mentioning it in reviews. Samsung has promised 4 years of security updates and 3 android major updates. There are 9 5G bands, so i assume this phone is truly 5G-ready in India. These points were enough for me to shift to this phone. I read some reviews complaining heating issues and ordinary design of this phone. Though I am not a heavy gamer, I use my phone for a long consecutive times. It only got warm during initial setup. But there was NO heating issue otherwise. About design, it is a personal choice. I am not a fan of glass backs (am i the only one on this planet?) Phone still looks very premium in my opinion. I switched from OP5 after almost 4 years. OP5 was one-of-its-kind, and was ahead of its time. Sadly oneplus is no more the enthusiast brand that it was some years ago. Single band 5g, shady updates (i heard op7, op7t got slower with the updates), and i just hate that 2/5 MP mono camera  that op is standardizing these days. Concluding, Samsun S20 FE 5G is a perfect choice for someone who is looking for non flashy, simple design yet truly functional and non-gimmicky experience in a device that can be used for around 3-3.5 years.",13 Jun 2021,Colour: Cloud Navy Size name: 8GB Style name: With offer,,Yes,NP,5.0,"Samsung Galaxy S20 FE 5G (Cloud Navy, 8GB RAM, 128GB Storage) with No Cost EMI & Additional Exchange Offers",https://www.amazon.in/Samsung-Galaxy-Cloud-128GB-Storage/product-reviews/B08VB57558/ref=cm_cr_dp_d_show_all_btm?ie=UTF8&reviewerType=all_reviews&pageNumber=3,in this era of 2mp macro mono depth stupidity in midrangers and budget flagships this device stands out with its pure functional and flagship like camera setup dex is another amazing functionality i wonder why people are not mentioning it in reviews samsung has promised 4 years of security updates and 3 android major updates there are 9 5g bands so i assume this phone is truly 5g ready in india these points were enough for me to shift to this phone i read some reviews complaining heating issues and ordinary design of this phone though i am not a heavy gamer i use my phone for a long consecutive times it only got warm during initial setup but there was no heating issue otherwise about design it is a personal choice i am not a fan of glass backs am i the only one on this planet phone still looks very premium in my opinion i switched from op5 after almost 4 years op5 was one of its kind and was ahead of its time sadly oneplus is no more the enthusiast brand that it was some years ago single band 5g shady updates i heard op7 op7t got slower with the updates and i just hate that 25 mp mono camera that op is standardizing these days concluding samsun s20 fe 5g is a perfect choice for someone who is looking for non flashy simple design yet truly functional and non gimmicky experience in a device that can be used for around 3 3 5 years,36,"['era', 'macro', 'depth', 'stupidity', 'midrangers', 'budget', 'flagships', 'device', 'flagship', 'camera', 'setup', 'dex', 'functionality', 'people', 'reviews', 'samsung', 'years', 'security', 'updates', 'updates', 'bands', 'phone', 'points', 'phone', 'reviews', 'heating', 'issues', 'design', 'phone', 'gamer', 'phone', 'times', 'setup', 'issue', 'design', 'choice', 'fan', 'glass', 'backs', 'one', 'planet', 'phone', 'opinion', 'op5', 'years', 'kind', 'time', 'enthusiast', 'brand', 'years', 'band', 'updates', 'op7t', 'updates', 'camera', 'days', 's20', 'choice', 'someone', 'simple', 'design', 'experience', 'device', 'years']"
37,Very satisfied 😌,"Got it recently and playing with it for a while, I can tell you I am quite satisfied  with  it and it's features😄. I can tell quite a lot of good things but I'll stop it's already  listed in the description.😉 Display is very good 👍, Battery backup is good. But I should have 0.5 star as my only complaint is it gets warm way to early while doing things, normal people shouldn't worry about it only little warm in intensive tasks like games and heavymultitasking. Hope things get better after an update. 😀",18 Apr 2021,Colour: Cloud Navy Size name: 8GB Style name: With offer,"https://images-na.ssl-images-amazon.com/images/I/81ZxcnDWfUL._SY88.jpg
https://images-na.ssl-images-amazon.com/images/I/81b8zSwThAL._SY88.jpg
https://images-na.ssl-images-amazon.com/images/I/91y9ZTbRSiL._SY88.jpg",Yes,Diganta Bardoloi,5.0,"Samsung Galaxy S20 FE 5G (Cloud Navy, 8GB RAM, 128GB Storage) with No Cost EMI & Additional Exchange Offers",https://www.amazon.in/Samsung-Galaxy-Cloud-128GB-Storage/product-reviews/B08VB57558/ref=cm_cr_dp_d_show_all_btm?ie=UTF8&reviewerType=all_reviews&pageNumber=3,got it recently and playing with it for a while i can tell you i am quite satisfied with it and its features i can tell quite a lot of good things but ill stop its already listed in the description display is very good battery backup is good but i should have 0 5 star as my only complaint is it gets warm way to early while doing things normal people shouldnt worry about it only little warm in intensive tasks like games and heavymultitasking hope things get better after an update,37,"['while', 'features', 'lot', 'things', 'description', 'display', 'battery', 'backup', 'star', 'complaint', 'way', 'things', 'people', 'tasks', 'games', 'hope', 'things', 'update']"
38,Amazon will make a fool out of you!,"I purchased this expensive Samsung phone for the first time in my life from Amazon, I missed few days from the return period to inform that my phone doesn't get calls or sms at all as it took some time to understand. The customer care roited me to Samsung service center and service center won't replace your brand new product, instead they'll repair it for you as you've bought it from Amazon not Samsung shop. I'm feeling helpless and disgusted by Amazon customer support.",07 Jul 2021,Colour: Cloud Green Size name: 8GB RAM + 128GB Storage Style name: With offer,,Yes,Shree,1.0,"Samsung Galaxy S20 FE 5G (Cloud Navy, 8GB RAM, 128GB Storage) with No Cost EMI & Additional Exchange Offers",https://www.amazon.in/Samsung-Galaxy-Cloud-128GB-Storage/product-reviews/B08VB57558/ref=cm_cr_dp_d_show_all_btm?ie=UTF8&reviewerType=all_reviews&pageNumber=3,i purchased this expensive samsung phone for the first time in my life from amazon i missed few days from the return period to inform that my phone doesnt get calls or sms at all as it took some time to understand the customer care roited me to samsung service center and service center wont replace your brand new product instead theyll repair it for you as youve bought it from amazon not samsung shop im feeling helpless and disgusted by amazon customer support,38,"['samsung', 'phone', 'time', 'life', 'amazon', 'days', 'return', 'period', 'phone', 'doesnt', 'calls', 'sms', 'time', 'customer', 'care', 'service', 'center', 'service', 'center', 'brand', 'product', 'repair', 'shop', 'feeling', 'helpless', 'amazon', 'customer', 'support']"
